{
  "schema": "pfl.glyph/1",
  "id": "zaner-bloser/t.default",
  "char": "t", "case": "lower", "variant": "default",
  "advance": 0.695,
  "entry": { "class": "E-UP", "height": 1.5, "point": [0.846, 1.5], "tangent": [0.388, 0.922] },
  "exit": { "class": "X-BASE", "point": [0.695, 0.15], "tangent": [0.862, 0.508] },
  "leadIn": { "segments": [
    { "c": [[-0.2, 0.0], [0.067, 0.02], [0.551, 0.8], [0.846, 1.5]], "label": "t.up" }
  ] },
  "leadOut": { "segments": [
    { "c": [[0.695, 0.15], [0.817, 0.222], [1.078, 0.49], [1.244, 0.67]], "label": "t.undercurveOut" }
  ] },
  "strokes": [
    {
      "id": "s1", "order": 1,
      "segments": [
        { "l": [[0.846, 1.5], [0.402, 0.28]], "retrace": true, "label": "t.downSameLine" },
        { "c": [[0.402, 0.28], [0.336, 0.1], [0.44, 0.0], [0.695, 0.15]], "label": "t.undercurveOut" }
      ]
    }
  ],
  "deferred": [
    {
      "id": "bar", "kind": "bar", "direction": "ltr",
      "segments": [
        { "l": [[0.304, 1.0], [1.024, 1.0]], "label": "t.bar" }
      ],
      "anchor": { "stroke": "s1", "t": 0.297, "offset": [0.0, 0.0] }
    }
  ],
  "keypoints": [
    { "type": "start", "stroke": "s1", "t": 0.0 },
    { "type": "baselineTouch", "stroke": "s1", "t": 0.876 },
    { "type": "end", "stroke": "s1", "t": 1.0 }
  ],
  "features": ["retrace", "deferred"],
  "checks": {
    "reach": [ { "line": "xHeight", "extreme": "max", "target": 1.5 } ],
    "retrace": [ { "stroke": "s1", "segment": 0 } ]
  },
  "animation": {
    "startDot": "leadIn",
    "numbers": [{ "stroke": "s1", "at": [1.066, 1.56] }, { "stroke": "bar", "at": [0.134, 1.0] }],
    "arrows": [{ "stroke": "s1", "t": 0.475 }, { "stroke": "s1", "t": 0.851 }, { "stroke": "bar", "t": 0.8 }]
  },
  "meta": { "author": "agent:V0.4", "source": "illustrative", "reviewed": false, "license": "project data", "notes": "Illustrative shape, not checked against the Zaner-Bloser copybook. Slant 20 deg; t height 1.5 x-height." }
}
